[
  {
    "event_id": "E001",
    "event_type": "POLICY_GOAL_DEFINED",
    "aggregate_type": "policy_goal",
    "aggregate_id": "goal-155-culture",
    "occurred_at": "2026-01-10T09:00:00+08:00",
    "version": 1,
    "summary": "印发文化产业“十五五”规划，确立省级文化项目组合总目标",
    "actor_id": "U-PLAN-01",
    "actor_role": "PROVINCIAL_PLAN_OFFICER",
    "payload": {
      "code": "155-CULTURE",
      "name": "文化产业“十五五”高质量发展目标",
      "approval_no": "川文规〔2026〕1号",
      "metric_ids": ["M-TECH-01", "M-COUNTY-01", "M-TOUR-01", "M-OVERSEAS-01"]
    }
  },
  {
    "event_id": "E002",
    "event_type": "FUNDING_STREAM_OPENED",
    "aggregate_type": "funding_stream",
    "aggregate_id": "stream-tech",
    "occurred_at": "2026-01-12T09:00:00+08:00",
    "version": 1,
    "summary": "开放文化科技融合专项资金",
    "actor_role": "PROVINCIAL_PLAN_OFFICER",
    "payload": { "stream_code": "KJRH-2026", "category": "科技融合", "name": "文化科技融合专项", "approval_no": "川文财〔2026〕3号" }
  },
  {
    "event_id": "E003",
    "event_type": "FUNDING_STREAM_OPENED",
    "aggregate_type": "funding_stream",
    "aggregate_id": "stream-county",
    "occurred_at": "2026-01-12T09:10:00+08:00",
    "version": 1,
    "summary": "开放县域文化消费专项资金",
    "actor_role": "PROVINCIAL_PLAN_OFFICER",
    "payload": { "stream_code": "XYXF-2026", "category": "县域文化消费", "name": "县域文化消费专项", "approval_no": "川文财〔2026〕4号" }
  },
  {
    "event_id": "E004",
    "event_type": "FUNDING_STREAM_OPENED",
    "aggregate_type": "funding_stream",
    "aggregate_id": "stream-tour",
    "occurred_at": "2026-01-12T09:20:00+08:00",
    "version": 1,
    "summary": "开放文旅协同发展专项资金",
    "actor_role": "PROVINCIAL_PLAN_OFFICER",
    "payload": { "stream_code": "WLXT-2026", "category": "文旅协同", "name": "文旅协同发展专项", "approval_no": "川文财〔2026〕5号" }
  },
  {
    "event_id": "E005",
    "event_type": "FUNDING_STREAM_OPENED",
    "aggregate_type": "funding_stream",
    "aggregate_id": "stream-overseas",
    "occurred_at": "2026-01-12T09:30:00+08:00",
    "version": 1,
    "summary": "开放海外发行申报通道",
    "actor_role": "PROVINCIAL_PLAN_OFFICER",
    "payload": { "stream_code": "HWFB-2026", "category": "海外发行", "name": "海外发行扶持专项", "approval_no": "川文财〔2026〕6号" }
  },
  {
    "event_id": "E006",
    "event_type": "ASSESSMENT_PERIOD_OPENED",
    "aggregate_type": "assessment_period",
    "aggregate_id": "period-2026",
    "occurred_at": "2026-01-15T09:00:00+08:00",
    "version": 1,
    "summary": "开放2026年度考核期",
    "actor_role": "PROVINCIAL_PLAN_OFFICER",
    "payload": { "goal_id": "goal-155-culture", "year": 2026 }
  },
  {
    "event_id": "E007",
    "event_type": "TARGET_SET",
    "aggregate_type": "policy_goal",
    "aggregate_id": "goal-155-culture",
    "occurred_at": "2026-01-16T09:00:00+08:00",
    "version": 2,
    "summary": "下达2026年度文化科技融合成果转化指标30项",
    "actor_role": "PROVINCIAL_PLAN_OFFICER",
    "payload": { "period_id": "period-2026", "metric_id": "M-TECH-01", "target_value": 30 }
  },
  {
    "event_id": "E008",
    "event_type": "TARGET_SET",
    "aggregate_type": "policy_goal",
    "aggregate_id": "goal-155-culture",
    "occurred_at": "2026-01-16T09:10:00+08:00",
    "version": 3,
    "summary": "下达2026年度县域文化消费800万人次指标",
    "actor_role": "PROVINCIAL_PLAN_OFFICER",
    "payload": { "period_id": "period-2026", "metric_id": "M-COUNTY-01", "target_value": 800 }
  },
  {
    "event_id": "E009",
    "event_type": "TARGET_SET",
    "aggregate_type": "policy_goal",
    "aggregate_id": "goal-155-culture",
    "occurred_at": "2026-01-16T09:20:00+08:00",
    "version": 4,
    "summary": "下达2026年度文旅协同接待500万人次指标",
    "actor_role": "PROVINCIAL_PLAN_OFFICER",
    "payload": { "period_id": "period-2026", "metric_id": "M-TOUR-01", "target_value": 500 }
  },
  {
    "event_id": "E010",
    "event_type": "TARGET_SET",
    "aggregate_type": "policy_goal",
    "aggregate_id": "goal-155-culture",
    "occurred_at": "2026-01-16T09:30:00+08:00",
    "version": 5,
    "summary": "下达2026年度海外发行落地20项指标",
    "actor_role": "PROVINCIAL_PLAN_OFFICER",
    "payload": { "period_id": "period-2026", "metric_id": "M-OVERSEAS-01", "target_value": 20 }
  },
  {
    "event_id": "E011",
    "event_type": "METRIC_DEFINED",
    "aggregate_type": "outcome_measure",
    "aggregate_id": "M-TECH-01",
    "occurred_at": "2026-01-16T10:00:00+08:00",
    "version": 1,
    "summary": "定义指标：文化科技融合成果转化数（按软著登记号去重）",
    "payload": { "metric_id": "M-TECH-01", "name": "文化科技融合成果转化数", "unit": "项" }
  },
  {
    "event_id": "E012",
    "event_type": "METRIC_DEFINED",
    "aggregate_type": "outcome_measure",
    "aggregate_id": "M-COUNTY-01",
    "occurred_at": "2026-01-16T10:10:00+08:00",
    "version": 1,
    "summary": "定义指标：县域文化消费人次（按活动场次ID去重）",
    "payload": { "metric_id": "M-COUNTY-01", "name": "县域文化消费人次", "unit": "万人次" }
  },
  {
    "event_id": "E013",
    "event_type": "METRIC_DEFINED",
    "aggregate_type": "outcome_measure",
    "aggregate_id": "M-TOUR-01",
    "occurred_at": "2026-01-16T10:20:00+08:00",
    "version": 1,
    "summary": "定义指标：文旅协同带动接待量（按活动场次ID去重）",
    "payload": { "metric_id": "M-TOUR-01", "name": "文旅协同带动接待量", "unit": "万人次" }
  },
  {
    "event_id": "E014",
    "event_type": "METRIC_DEFINED",
    "aggregate_type": "outcome_measure",
    "aggregate_id": "M-OVERSEAS-01",
    "occurred_at": "2026-01-16T10:30:00+08:00",
    "version": 1,
    "summary": "定义指标：海外发行落地数（按海外发行备案号去重）",
    "payload": { "metric_id": "M-OVERSEAS-01", "name": "海外发行落地数", "unit": "项" }
  },

  {
    "event_id": "E015",
    "event_type": "SUBJECT_REGISTERED",
    "aggregate_type": "applicant_subject",
    "aggregate_id": "S-XINGHAN",
    "occurred_at": "2026-02-01T09:00:00+08:00",
    "version": 1,
    "summary": "星瀚文化集团完成主体登记",
    "payload": { "name": "星瀚文化集团有限公司", "unified_credit_code": "91510100MA6XH0001", "control_group_id": "G-XINGHAN" }
  },
  {
    "event_id": "E016",
    "event_type": "SUBJECT_REGISTERED",
    "aggregate_type": "applicant_subject",
    "aggregate_id": "S-XINGHAN-DIGITAL",
    "occurred_at": "2026-02-02T09:00:00+08:00",
    "version": 1,
    "summary": "星瀚数字科技子公司完成主体登记",
    "payload": { "name": "星瀚数字科技有限公司", "unified_credit_code": "91510100MA6XH0002", "control_group_id": "G-XINGHAN-DIGITAL" }
  },
  {
    "event_id": "E017",
    "event_type": "CONTROL_RELATION_DECLARED",
    "aggregate_type": "applicant_subject",
    "aggregate_id": "S-XINGHAN-DIGITAL",
    "occurred_at": "2026-02-03T09:00:00+08:00",
    "version": 2,
    "summary": "申报穿透：星瀚数字为星瀚文化集团控股子公司",
    "payload": { "parent_subject_id": "S-XINGHAN", "relation": "控股80%" }
  },
  {
    "event_id": "E018",
    "event_type": "SUBJECT_REGISTERED",
    "aggregate_type": "applicant_subject",
    "aggregate_id": "S-QL",
    "occurred_at": "2026-02-04T09:00:00+08:00",
    "version": 1,
    "summary": "青岚文旅公司完成主体登记",
    "payload": { "name": "青岚文旅发展有限公司", "unified_credit_code": "91510221MAQL00001", "control_group_id": "G-QINGLAN" }
  },
  {
    "event_id": "E019",
    "event_type": "SUBJECT_REGISTERED",
    "aggregate_type": "applicant_subject",
    "aggregate_id": "S-YS",
    "occurred_at": "2026-02-04T09:10:00+08:00",
    "version": 1,
    "summary": "远山文旅运营公司完成主体登记",
    "payload": { "name": "远山文旅运营有限公司", "unified_credit_code": "91510122MAYS00001", "control_group_id": "G-YUANSHAN" }
  },
  {
    "event_id": "E020",
    "event_type": "SUBJECT_REGISTERED",
    "aggregate_type": "applicant_subject",
    "aggregate_id": "S-YF",
    "occurred_at": "2026-02-05T09:00:00+08:00",
    "version": 1,
    "summary": "云帆互娱公司完成主体登记",
    "payload": { "name": "云帆互娱有限公司", "unified_credit_code": "91510200MAYF00001", "control_group_id": "G-YUNFAN" }
  },
  {
    "event_id": "E021",
    "event_type": "SUBJECT_REGISTERED",
    "aggregate_type": "applicant_subject",
    "aggregate_id": "S-TL",
    "occurred_at": "2026-02-05T09:10:00+08:00",
    "version": 1,
    "summary": "同路光影公司完成主体登记",
    "payload": { "name": "同路光影有限公司", "unified_credit_code": "91510100MATL00001", "control_group_id": "G-TONGLU" }
  },
  {
    "event_id": "E022",
    "event_type": "SUBJECT_REGISTERED",
    "aggregate_type": "applicant_subject",
    "aggregate_id": "S-HM",
    "occurred_at": "2026-02-05T09:20:00+08:00",
    "version": 1,
    "summary": "禾木演出公司（联合申报参与方）完成主体登记",
    "payload": { "name": "禾木演出有限公司", "unified_credit_code": "91510122MAHM00001", "control_group_id": "G-HEMU" }
  },

  {
    "event_id": "E023",
    "event_type": "APPLICATION_RECEIVED",
    "aggregate_type": "funding_application",
    "aggregate_id": "APP-XH-TECH",
    "occurred_at": "2026-02-10T14:00:00+08:00",
    "version": 1,
    "summary": "星瀚数字申报文化科技融合专项：AIGC演艺内容平台",
    "idempotency_key": "IDEMP-APP-XH-001",
    "payload": {
      "stream_id": "stream-tech",
      "goal_id": "goal-155-culture",
      "period_id": "period-2026",
      "lead_subject_id": "S-XINGHAN-DIGITAL",
      "co_subject_ids": [],
      "budget_requested_wan": 520,
      "regions": ["510121", "510122"],
      "metric_contributions": [{ "metric_id": "M-TECH-01" }],
      "expense_items": [
        { "item_key": "EXP-AIGC-CLUSTER", "name": "AIGC渲染集群租赁与算力服务", "amount_wan": 220 }
      ]
    }
  },
  {
    "event_id": "E024",
    "event_type": "APPLICATION_RECEIVED",
    "aggregate_type": "funding_application",
    "aggregate_id": "APP-XH-COUNTY",
    "occurred_at": "2026-02-12T14:00:00+08:00",
    "version": 1,
    "summary": "星瀚集团申报县域文化消费专项：数字影院进县域",
    "payload": {
      "stream_id": "stream-county",
      "goal_id": "goal-155-culture",
      "period_id": "period-2026",
      "lead_subject_id": "S-XINGHAN",
      "co_subject_ids": [],
      "budget_requested_wan": 300,
      "regions": ["510121"],
      "metric_contributions": [{ "metric_id": "M-COUNTY-01" }],
      "expense_items": [
        { "item_key": "EXP-AIGC-CLUSTER", "name": "AIGC渲染集群租赁（同一笔算力支出）", "amount_wan": 220 }
      ]
    }
  },
  {
    "event_id": "E025",
    "event_type": "APPLICATION_RECEIVED",
    "aggregate_type": "funding_application",
    "aggregate_id": "APP-QL-COUNTY",
    "occurred_at": "2026-02-14T10:00:00+08:00",